<?xml version="1.0"?>
<xs:schema xmlns:xs="http://www.w3.org/2001/XMLSchema">

  <xs:element name="catalogo">
    <xs:complexType>
      <xs:sequence>
        <xs:element name="vehiculo" maxOccurs="10">
          <xs:complexType>
            <xs:sequence>
              <xs:element name="nombre" type="xs:string"/>
              <xs:element name="precio" type="xs:decimal"/>
              <xs:element name="descripcion" type="xs:string"/>
              <xs:element name="marca" type="xs:string"/>
            </xs:sequence>
            <xs:attribute name="id" type="xs:integer" use="required"/>
          </xs:complexType>
        </xs:element>
      </xs:sequence>
    </xs:complexType>
  </xs:element>

</xs:schema>